{
  "schema_version": "0.2.0",
  "approval_status": "proposed",
  "review_id": "review_synthetic-v2",
  "experiment": {
    "identifier": "synthetic-v2",
    "type": "documented_shading",
    "start": "2026-10-09T10:00:00Z",
    "end": "2026-10-09T11:00:00Z"
  },
  "provenance": {
    "protocol_sha256": "aaaaaaaaaaaaaaaaaaaaaaaaaaaaaaaaaaaaaaaaaaaaaaaaaaaaaaaaaaaaaaaa",
    "source_checksums": [
      {
        "file": "SYNTHETIC-a.csv",
        "md5": "bbbbbbbbbbbbbbbbbbbbbbbbbbbbbbbb",
        "sha256": "cccccccccccccccccccccccccccccccccccccccccccccccccccccccccccccccc"
      },
      {
        "file": "SYNTHETIC-b.csv",
        "md5": "dddddddddddddddddddddddddddddddd",
        "sha256": "eeeeeeeeeeeeeeeeeeeeeeeeeeeeeeeeeeeeeeeeeeeeeeeeeeeeeeeeeeeeeeee"
      }
    ],
    "model": {
      "name": "SYNTHETIC MODEL ONLY"
    },
    "splits": {
      "description": "Synthetic dates, not research splits."
    },
    "thresholds": {
      "description": "No real thresholds; fixture values only."
    },
    "evaluation_population": "SYNTHETIC TEST POPULATION ONLY",
    "grouping": {
      "description": "Synthetic grouping placeholder."
    },
    "label_use": "Synthetic test labels only.",
    "exclusions": [],
    "retrospective": true,
    "code_version": "synthetic-test-code"
  },
  "metrics": [
    {
      "id": "healthy_mae",
      "availability": "estimated",
      "value": 13.0,
      "unit": "W",
      "population": "SYNTHETIC TEST POPULATION ONLY",
      "definition": "Invented for backend tests; not a research definition.",
      "calculation": "Synthetic test value only.",
      "reason": null,
      "coverage": {
        "valid_seconds": 90.0,
        "observed_labelled_seconds": 100.0,
        "wall_span_seconds": 120.0
      }
    },
    {
      "id": "healthy_nmae",
      "availability": "estimated",
      "value": 0.013,
      "unit": "1",
      "population": "SYNTHETIC TEST POPULATION ONLY",
      "definition": "Invented for backend tests; not a research definition.",
      "calculation": "Synthetic test value only.",
      "reason": null,
      "coverage": {
        "valid_seconds": 90.0,
        "observed_labelled_seconds": 100.0,
        "wall_span_seconds": 120.0
      },
      "ratio": {
        "numerator": 13.0,
        "denominator": 1000.0,
        "numerator_unit": "W",
        "denominator_unit": "W"
      }
    },
    {
      "id": "healthy_bias",
      "availability": "unavailable",
      "value": null,
      "unit": "W",
      "population": "SYNTHETIC TEST POPULATION ONLY",
      "definition": "Invented for backend tests; not a research definition.",
      "calculation": "Synthetic test value only.",
      "reason": "SYNTHETIC missing value test.",
      "coverage": {
        "valid_seconds": 90.0,
        "observed_labelled_seconds": 100.0,
        "wall_span_seconds": 120.0
      }
    },
    {
      "id": "episode_recall",
      "availability": "estimated",
      "value": 0.75,
      "unit": "1",
      "population": "SYNTHETIC TEST POPULATION ONLY",
      "definition": "Invented for backend tests; not a research definition.",
      "calculation": "Synthetic test value only.",
      "reason": null,
      "coverage": {
        "valid_seconds": 90.0,
        "observed_labelled_seconds": 100.0,
        "wall_span_seconds": 120.0
      },
      "ratio": {
        "numerator": 3,
        "denominator": 4,
        "numerator_unit": "episodes",
        "denominator_unit": "episodes"
      }
    },
    {
      "id": "healthy_alarm_runs_per_hour",
      "availability": "estimated",
      "value": 0.1,
      "unit": "alarms/hour",
      "population": "SYNTHETIC TEST POPULATION ONLY",
      "definition": "Invented for backend tests; not a research definition.",
      "calculation": "Synthetic test value only.",
      "reason": null,
      "coverage": {
        "valid_seconds": 90.0,
        "observed_labelled_seconds": 100.0,
        "wall_span_seconds": 120.0
      },
      "ratio": {
        "numerator": 1,
        "denominator": 10,
        "numerator_unit": "alarm runs",
        "denominator_unit": "hours"
      }
    },
    {
      "id": "signed_generation_deviation",
      "availability": "estimated",
      "value": -0.25,
      "unit": "kWh",
      "population": "SYNTHETIC TEST POPULATION ONLY",
      "definition": "Invented for backend tests; not a research definition.",
      "calculation": "Synthetic test value only.",
      "reason": null,
      "coverage": {
        "valid_seconds": 90.0,
        "observed_labelled_seconds": 100.0,
        "wall_span_seconds": 120.0
      },
      "uncertainty": {
        "kind": "empirical_model_error_band",
        "method": "Synthetic band for tests only.",
        "unit": "kWh",
        "lower": -0.3,
        "upper": -0.2,
        "group_count": 5,
        "limitations": ["SYNTHETIC test-only uncertainty."]
      }
    },
    {
      "id": "positive_only_generation_deviation",
      "availability": "estimated",
      "value": 0.1,
      "unit": "kWh",
      "population": "SYNTHETIC TEST POPULATION ONLY",
      "definition": "Invented for backend tests; not a research definition.",
      "calculation": "Synthetic test value only.",
      "reason": null,
      "coverage": {
        "valid_seconds": 90.0,
        "observed_labelled_seconds": 100.0,
        "wall_span_seconds": 120.0
      }
    },
    {
      "id": "observed_energy",
      "availability": "estimated",
      "value": 0.5,
      "unit": "kWh",
      "population": "SYNTHETIC TEST POPULATION ONLY",
      "definition": "Invented for backend tests; not a research definition.",
      "calculation": "Synthetic test value only.",
      "reason": null,
      "coverage": {
        "valid_seconds": 90.0,
        "observed_labelled_seconds": 100.0,
        "wall_span_seconds": 120.0
      }
    },
    {
      "id": "expected_energy",
      "availability": "unavailable",
      "value": null,
      "unit": "kWh",
      "population": "SYNTHETIC TEST POPULATION ONLY",
      "definition": "Invented for backend tests; not a research definition.",
      "calculation": "Synthetic test value only.",
      "reason": "SYNTHETIC test missing expected-energy value.",
      "coverage": {
        "valid_seconds": 90.0,
        "observed_labelled_seconds": 100.0,
        "wall_span_seconds": 120.0
      }
    }
  ],
  "series": {
    "timestamp_basis": "UTC",
    "power_unit": "W",
    "downsampling": {
      "method": "none; synthetic samples",
      "source_count": 2,
      "retained_count": 2,
      "gap_markers": []
    },
    "samples": [
      {
        "timestamp": "2026-10-09T10:00:00Z",
        "measured_power": 500.0,
        "raw_reference_power": 550.0,
        "expected_power": 525.0,
        "valid": true
      },
      {
        "timestamp": "2026-10-09T10:30:00Z",
        "measured_power": null,
        "raw_reference_power": null,
        "expected_power": null,
        "valid": false
      }
    ]
  },
  "electrical_evidence": [
    {
      "signal": "Va",
      "measurement": 154.6,
      "unit": "V",
      "quality": "SYNTHETIC quality description.",
      "comparison_population": "SYNTHETIC test population.",
      "supports": "A synthetic operating-point observation only.",
      "does_not_prove": "No fault diagnosis.",
      "alternatives": ["SYNTHETIC alternative."],
      "missing_measurements": ["SYNTHETIC missing measurement."],
      "strength": "LIMITED"
    }
  ],
  "candidate_checks": [
    {
      "id": "synthetic-check-1",
      "observed_fact": "SYNTHETIC observed fact only.",
      "hypothesis": "SYNTHETIC candidate hypothesis only.",
      "supporting_evidence": ["SYNTHETIC support."],
      "opposing_evidence": ["SYNTHETIC alternative evidence."],
      "next_information": ["SYNTHETIC next information."],
      "qualification": "SYNTHETIC qualification boundary.",
      "safety_constraint": "No physical work; synthetic fixture only.",
      "sources": ["https://example.invalid/synthetic-source"],
      "status": "proposed"
    }
  ],
  "decision": {
    "verdict": "LIMIT",
    "rule_version": "synthetic-test-rule",
    "reasons": ["SYNTHETIC decision reason only."],
    "owner_review": null
  },
  "limitations": [
    "SYNTHETIC fixture only; no measured or publishable findings."
  ]
}
